[
  {
    "symbol": "EXCO",
    "instrument_id": "00000000-0000-4000-8000-000000000010",
    "valid_from": "2020-01-01",
    "valid_to": "2026-06-30"
  },
  {
    "symbol": "BRK.B",
    "instrument_id": "00000000-0000-4000-8000-000000000010",
    "valid_from": "2020-01-01",
    "valid_to": null
  }
]
